{
  "$schema": "../../schemas/adapter-manifest.schema.json",
  "schema": 1,
  "name": "go",
  "language": "go",
  "command": [
    "./adapter"
  ],
  "build": [
    "go",
    "build",
    "-o",
    "adapter",
    "."
  ],
  "cwd": ".",
  "capabilities": [
    "challenge.parse",
    "challenge.format",
    "credential.parse",
    "credential.format",
    "receipt.parse",
    "receipt.format",
    "base64url.encode",
    "base64url.decode",
    "challenge.id",
    "http.payment_request",
    "server.verify",
    "tempo.receipt.verify",
    "tempo.proof.verify",
    "tempo.proof.typed_data"
  ]
}
